[
  {
    "code": 40,
    "name": "Араукария",
    "taxon": "Araucaria, комнатное контейнерное дерево",
    "sourceUrls": [
      "https://www.rhs.org.uk/plants/1461/araucaria-heterophylla/details",
      "https://www.rhs.org.uk/plants/types/houseplants/growing-guide"
    ],
    "passport": {
      "humidity": "Араукарии подходит обычная или умеренно повышенная влажность воздуха. Не ставьте горшок вплотную к горячей батарее; при сухом воздухе полезно увлажнять воздух вокруг растения.",
      "temperature": "Держите араукарию в светлом месте без мороза и холодных сквозняков. Летом можно вынести её в защищённое место, а до похолодания вернуть в помещение.",
      "soil": "Нужен рыхлый, хорошо дренируемый грунт для горшечных деревьев с минеральным разрыхлителем. В горшке обязательны дренажные отверстия.",
      "fertilizer": "С марта по сентябрь подкармливайте сбалансированным удобрением по инструкции; зимой, когда рост замедлен, подкормки прекратите.",
      "growthRate": "Араукария постепенно наращивает центральный побег и новые ярусы ветвей. В горшке её рост зависит от света, объёма корней и сезонных условий."
    }
  },
  {
    "code": 853,
    "name": "Араукария 20 см D10",
    "taxon": "Araucaria, комнатное контейнерное дерево",
    "sourceUrls": [
      "https://www.rhs.org.uk/plants/1461/araucaria-heterophylla/details",
      "https://www.rhs.org.uk/plants/types/houseplants/growing-guide"
    ],
    "passport": {
      "humidity": "Араукарии подходит обычная или умеренно повышенная влажность воздуха. Не ставьте горшок вплотную к горячей батарее; при сухом воздухе полезно увлажнять воздух вокруг растения.",
      "temperature": "Держите араукарию в светлом месте без мороза и холодных сквозняков. Летом можно вынести её в защищённое место, а до похолодания вернуть в помещение.",
      "soil": "Нужен рыхлый, хорошо дренируемый грунт для горшечных деревьев с минеральным разрыхлителем. В горшке обязательны дренажные отверстия.",
      "fertilizer": "С марта по сентябрь подкармливайте сбалансированным удобрением по инструкции; зимой, когда рост замедлен, подкормки прекратите.",
      "growthRate": "Араукария постепенно наращивает центральный побег и новые ярусы ветвей. В горшке её рост зависит от света, объёма корней и сезонных условий."
    }
  },
  {
    "code": 33,
    "name": "Антуриум",
    "taxon": "Anthurium, цветущая комнатная группа",
    "sourceUrls": [
      "https://www.rhs.org.uk/plants/anthuriums/how-to-grow-anthuriums"
    ],
    "passport": {
      "growthRate": "Антуриум постепенно наращивает новые листья. При стабильном тепле и ярком рассеянном свете может выпускать цветоносы повторно; зимой рост обычно замедляется."
    }
  },
  {
    "code": 851,
    "name": "Антуриум Блэк Бьюти (Anthurium Black Beauty) D17",
    "taxon": "Anthurium, цветущая комнатная группа",
    "sourceUrls": [
      "https://www.rhs.org.uk/plants/anthuriums/how-to-grow-anthuriums"
    ],
    "passport": {
      "growthRate": "Антуриум постепенно наращивает новые листья. При стабильном тепле и ярком рассеянном свете может выпускать цветоносы повторно; зимой рост обычно замедляется."
    }
  },
  {
    "code": 852,
    "name": "Антуриум Блэк Лав (Andreanum «Black Love») D17",
    "taxon": "Anthurium, цветущая комнатная группа",
    "sourceUrls": [
      "https://www.rhs.org.uk/plants/anthuriums/how-to-grow-anthuriums"
    ],
    "passport": {
      "growthRate": "Антуриум постепенно наращивает новые листья. При стабильном тепле и ярком рассеянном свете может выпускать цветоносы повторно; зимой рост обычно замедляется."
    }
  },
  {
    "code": 36,
    "name": "Антуриум Колорадо",
    "taxon": "Anthurium, цветущая комнатная группа",
    "sourceUrls": [
      "https://www.rhs.org.uk/plants/anthuriums/how-to-grow-anthuriums"
    ],
    "passport": {
      "growthRate": "Антуриум постепенно наращивает новые листья. При стабильном тепле и ярком рассеянном свете может выпускать цветоносы повторно; зимой рост обычно замедляется."
    }
  },
  {
    "code": 37,
    "name": "Антуриум Лилли",
    "taxon": "Anthurium, цветущая комнатная группа",
    "sourceUrls": [
      "https://www.rhs.org.uk/plants/anthuriums/how-to-grow-anthuriums"
    ],
    "passport": {
      "growthRate": "Антуриум постепенно наращивает новые листья. При стабильном тепле и ярком рассеянном свете может выпускать цветоносы повторно; зимой рост обычно замедляется."
    }
  },
  {
    "code": 855,
    "name": "Антуриум Мелодия Ибис (Anthurium Melodia Ibis) D17",
    "taxon": "Anthurium, цветущая комнатная группа",
    "sourceUrls": [
      "https://www.rhs.org.uk/plants/anthuriums/how-to-grow-anthuriums"
    ],
    "passport": {
      "growthRate": "Антуриум постепенно наращивает новые листья. При стабильном тепле и ярком рассеянном свете может выпускать цветоносы повторно; зимой рост обычно замедляется."
    }
  },
  {
    "code": 34,
    "name": "Антуриум Аляска",
    "taxon": "Anthurium, цветущая комнатная группа",
    "sourceUrls": [
      "https://www.rhs.org.uk/plants/anthuriums/how-to-grow-anthuriums"
    ],
    "passport": {
      "growthRate": "Антуриум постепенно наращивает новые листья. При стабильном тепле и ярком рассеянном свете может выпускать цветоносы повторно; зимой рост обычно замедляется."
    }
  },
  {
    "code": 38,
    "name": "Антуриум Луизиана",
    "taxon": "Anthurium, цветущая комнатная группа",
    "sourceUrls": [
      "https://www.rhs.org.uk/plants/anthuriums/how-to-grow-anthuriums"
    ],
    "passport": {
      "growthRate": "Антуриум постепенно наращивает новые листья. При стабильном тепле и ярком рассеянном свете может выпускать цветоносы повторно; зимой рост обычно замедляется."
    }
  },
  {
    "code": 39,
    "name": "Антуриум Оранж Чемпион",
    "taxon": "Anthurium, цветущая комнатная группа",
    "sourceUrls": [
      "https://www.rhs.org.uk/plants/anthuriums/how-to-grow-anthuriums"
    ],
    "passport": {
      "growthRate": "Антуриум постепенно наращивает новые листья. При стабильном тепле и ярком рассеянном свете может выпускать цветоносы повторно; зимой рост обычно замедляется."
    }
  },
  {
    "code": 35,
    "name": "Антуриум варок",
    "taxon": "Anthurium warocqueanum",
    "sourceUrls": [
      "https://www.rhs.org.uk/plants/anthuriums/how-to-grow-anthuriums",
      "https://powo.science.kew.org/taxon/85496-1"
    ],
    "passport": {
      "growthRate": "Антуриум постепенно наращивает декоративные листья; их размер увеличивается по мере взросления растения. Скорость роста зависит от тепла, света и состояния корней."
    }
  }
]
