[
  {"code":103,"name":"Драцена Розовая","taxon":"Dracaena, древесные комнатные формы","sourceUrls":["https://www.rhs.org.uk/plants/dracaena/how-to-grow-dracaena"],"passport":{"repotting":"Пересаживайте весной, когда корни заполнят горшок, в ёмкость лишь немного шире прежней. Слишком большой запас влажного грунта повышает риск загнивания корней."}},
  {"code":114,"name":"Кактус Микс","taxon":"ассортимент комнатных кактусов","sourceUrls":["https://www.rhs.org.uk/plants/types/cacti-succulents/houseplants/growing-guide"],"passport":{"repotting":"Пересаживайте весной, если корни заполнили горшок или растение переросло его. Выбирайте небольшой горшок с отверстиями и рыхлый грунт для кактусов; при работе с колючками защитите руки."}},
  {"code":115,"name":"Кактус (с цветками)","taxon":"ассортимент комнатных кактусов","sourceUrls":["https://www.rhs.org.uk/plants/types/cacti-succulents/houseplants/growing-guide"],"passport":{"repotting":"Пересаживайте весной, когда корни заполнят горшок, в ёмкость лишь немного больше прежней. Нужны дренажные отверстия и рыхлый грунт для кактусов; не пересаживайте только ради цветения."}},
  {"code":122,"name":"Кордилина","taxon":"Cordyline","sourceUrls":["https://www.rhs.org.uk/plants/cordyline/growing-guide"],"passport":{"repotting":"Весной проверьте, хватает ли корням места. При тесном горшке перевалите кордилину в чуть большую ёмкость с отверстиями; у крупного растения можно обновить верхний слой грунта."}},
  {"code":164,"name":"Пальмы микс (Арека и Хамедорея)","taxon":"Dypsis и Chamaedorea, ассортимент комнатных пальм","sourceUrls":["https://www.rhs.org.uk/plants/types/trees/indoor-palms"],"passport":{"repotting":"Комнатные пальмы пересаживайте ранней весной, только если корни заполнили горшок. Новый горшок берите немного больше прежнего и сохраняйте корневой ком; у крупных экземпляров обновляйте верхний слой грунта."}},
  {"code":181,"name":"Соланум (Паслен)","taxon":"Solanum, декоративный паслён","sourceUrls":["https://www.rhs.org.uk/container-gardening/how-to-repot-a-plant"],"passport":{"repotting":"Если растение сохраняют после сезона, пересаживайте весной при тесном горшке. Используйте ёмкость немного больше прежней с дренажными отверстиями и свежим рыхлым грунтом; не травмируйте корни без необходимости."}},
  {"code":187,"name":"Суккулент (микс)","taxon":"ассортимент комнатных суккулентов","sourceUrls":["https://www.rhs.org.uk/plants/types/cacti-succulents/houseplants/growing-guide"],"passport":{"repotting":"Пересаживайте весной, когда корни заполнили горшок или растение стало неустойчивым. Возьмите ёмкость немного больше прежней, с отверстиями и хорошо дренируемым грунтом для суккулентов."}},
  {"code":241,"name":"Шеффлера","taxon":"Schefflera/Heptapleurum, комнатная группа","sourceUrls":["https://www.rhs.org.uk/container-gardening/how-to-repot-a-plant"],"passport":{"repotting":"Весной проверьте корневой ком: если корни плотно оплели грунт, перевалите растение в горшок немного больше прежнего. Используйте рыхлый грунт для комнатных растений и ёмкость с дренажными отверстиями."}},
  {"code":242,"name":"Шеффлера (Герда)","taxon":"Schefflera/Heptapleurum, торговое название","sourceUrls":["https://www.rhs.org.uk/container-gardening/how-to-repot-a-plant"],"passport":{"repotting":"Весной проверьте корневой ком: если корни плотно оплели грунт, перевалите растение в горшок немного больше прежнего. Используйте рыхлый грунт для комнатных растений и ёмкость с дренажными отверстиями."}},
  {"code":243,"name":"Шеффлера Луизиана","taxon":"Schefflera/Heptapleurum, торговое название","sourceUrls":["https://www.rhs.org.uk/container-gardening/how-to-repot-a-plant"],"passport":{"repotting":"Весной проверьте корневой ком: если корни плотно оплели грунт, перевалите растение в горшок немного больше прежнего. Используйте рыхлый грунт для комнатных растений и ёмкость с дренажными отверстиями."}},
  {"code":40,"name":"Араукария","taxon":"Araucaria, комнатная форма","sourceUrls":["https://www.rhs.org.uk/plants/1461/araucaria-heterophylla/details","https://www.rhs.org.uk/container-gardening/how-to-repot-a-plant"],"passport":{"repotting":"Переваливайте весной, только когда корни заполнили горшок. Возьмите ёмкость немного больше прежней с хорошим дренажом; старайтесь сохранить корневой ком и прежнюю глубину посадки."}},
  {"code":51,"name":"Бонсай Азалия","taxon":"Rhododendron, бонсай азалии","sourceUrls":["https://www.rhs.org.uk/plants/types/trees/bonsai","https://www.rhs.org.uk/plants/rhododendron/indoor-azaleas"],"passport":{"repotting":"Пересаживайте бонсай при уплотнении субстрата и тесноте корней, обычно после цветения или в подходящий весенний период. Сохраняйте неглубокую ёмкость и кислый субстрат для азалий; обрезку корней проводите осторожно."}},
  {"code":53,"name":"Бонсай Азалия мелколистная","taxon":"Rhododendron, мелколистная бонсай азалия","sourceUrls":["https://www.rhs.org.uk/plants/types/trees/bonsai","https://www.rhs.org.uk/plants/rhododendron/indoor-azaleas"],"passport":{"repotting":"Пересаживайте бонсай при уплотнении субстрата и тесноте корней, обычно после цветения или в подходящий весенний период. Сохраняйте неглубокую ёмкость и кислый субстрат для азалий; обрезку корней проводите осторожно."}},
  {"code":54,"name":"Бонсай Араукария","taxon":"Araucaria в форме бонсай","sourceUrls":["https://www.rhs.org.uk/plants/types/trees/bonsai","https://www.rhs.org.uk/container-gardening/how-to-repot-a-plant"],"passport":{"repotting":"Пересаживайте весной, когда корни заполнят плошку и субстрат станет плотным. Осторожно перевалите в хорошо дренируемую смесь, сохранив большую часть корневого кома; сильную обрезку корней не проводите."}},
  {"code":57,"name":"Бонсай Зантоксилум","taxon":"Zanthoxylum, бонсай","sourceUrls":["https://www.rhs.org.uk/plants/types/trees/bonsai"],"passport":{"repotting":"Проверяйте состояние корней и субстрата каждую весну. Пересаживайте при тесной плошке или уплотнённом грунте, осторожно обновляя дренируемую смесь и сохраняя достаточно корней для восстановления."}},
  {"code":58,"name":"Бонсай Зелкова","taxon":"Zelkova, бонсай без подтверждённого вида","sourceUrls":["https://www.rhs.org.uk/plants/types/trees/bonsai"],"passport":{"repotting":"Пересаживайте весной до активного роста, если корни плотно заполнили плошку или грунт уплотнился. Используйте дренируемый субстрат для бонсай и осторожно работайте с корнями."}},
  {"code":76,"name":"Бонсай Подокарпус","taxon":"Podocarpus, бонсай","sourceUrls":["https://www.rhs.org.uk/plants/types/trees/bonsai"],"passport":{"repotting":"Осматривайте корневой ком весной и пересаживайте, когда плошка стала тесной или субстрат потерял рыхлость. Возьмите хорошо дренируемую смесь для бонсай; не удаляйте слишком много корней за один раз."}},
  {"code":78,"name":"Бонсай Радермахера","taxon":"Radermachera, бонсай","sourceUrls":["https://www.rhs.org.uk/plants/types/trees/bonsai","https://www.rhs.org.uk/container-gardening/how-to-repot-a-plant"],"passport":{"repotting":"Пересаживайте весной, если корни заполнили плошку и вода плохо проходит через субстрат. Обновите рыхлую дренируемую смесь, сохранив основную часть корневого кома; после пересадки берегите от пересыхания."}},
  {"code":81,"name":"Бонсай Самшит прямой","taxon":"Buxus, бонсай без подтверждённого вида","sourceUrls":["https://www.rhs.org.uk/plants/types/trees/bonsai"],"passport":{"repotting":"Пересаживайте весной при тесной плошке или уплотнённом субстрате. Осторожно обновите дренируемую смесь и корни, сохранив достаточный объём корневого кома для восстановления растения."}},
  {"code":853,"name":"Араукария 20 см D10","taxon":"Araucaria, комнатная форма","sourceUrls":["https://www.rhs.org.uk/plants/1461/araucaria-heterophylla/details","https://www.rhs.org.uk/container-gardening/how-to-repot-a-plant"],"passport":{"repotting":"Переваливайте весной, только когда корни заполнили горшок. Возьмите ёмкость немного больше прежней с хорошим дренажом; старайтесь сохранить корневой ком и прежнюю глубину посадки."}},
  {"code":864,"name":"Бонсай Фисташка D15","taxon":"Pistacia, бонсай без подтверждённого вида","sourceUrls":["https://www.rhs.org.uk/plants/types/trees/bonsai"],"passport":{"repotting":"Весной проверьте, не заполнили ли корни плошку. При тесноте пересадите в дренируемый субстрат для бонсай, аккуратно работая с корнями; не увеличивайте объём сырого грунта резко."}},
  {"code":88,"name":"Гибискус","taxon":"Hibiscus, комнатный декоративный гибискус","sourceUrls":["https://www.rhs.org.uk/plants/hibiscus/growing-guide/"],"passport":{"repotting":"Пересаживайте весной, когда корни заполнят горшок, в ёмкость немного больше прежней с дренажными отверстиями. Используйте свежий рыхлый грунт для цветущих комнатных растений и не заглубляйте основание стебля."}}
]
